claim_id,claim,true_label
scifact_480,Gpr124 suppresses BBB breakdown in mouse models of ischemic stroke.,supported
scifact_505,Helicobacter pylori-induced aberrant NF-kB-dependent expression of activation-induced cytidine deaminase contributes to the mutagenesis of host DNA.,supported
scifact_504,Healthy volunteers exhibit rapid and transient increase of cellular ATP after being bolus-injected with fructose.,refuted
scifact_500,Headaches are correlated with cognitive impairment.,refuted
scifact_499,HbA1c consistently overestimates glycemic control in black individuals with Sickle cell trait (SCT).,refuted
scifact_498,Having a main partner worsens HIV outcomes.,refuted
scifact_495,Having a main partner improves HIV outcomes.,supported
scifact_530,"Human embryonic stem cells give rise to cell types from the outer embryonic germ layer, but not the other two layers.",refuted
scifact_529,Human embryonic stem cells give rise to cell types from all three embryonic germ layers.,supported
scifact_524,"Higher plasma levels of I-carnitine, when associated with trimethylamine N-oxide, are positively correlated with cardiovascular events in humans.",supported
scifact_523,"Higher plasma levels of I-carnitine, when associated with trimethylamine N-oxide, are negatively correlated with cardiovascular events in humans.",refuted
scifact_515,High levels of CRP lead to a higher risk of exacerbations in chronic obstructive pulmonary disease (COPD).,supported
scifact_506,Helminths interfere with immune system control of coinfections by microbial pathogens 16.,supported
scifact_562,Improvements in OER catalysts show stable activity over several hundred hours.,supported
scifact_559,Immune responses in immune cells are geographically segregated.,supported
scifact_553,IgA plasma cells that are specific for transglutaminase 2 are scarce in the duodenal mucosa of celiac disease patients when the disease is active.,refuted
scifact_548,IL-6 signaling plays a major role in atherosclerotic cardiovascular disease.,supported
scifact_547,IL-10 production by monocytes inhibits CD4 + T cell response.,supported
scifact_542,"IFI16 impedes STING phosphorylation and translocation, resulting in reduced activation of STING.",refuted
scifact_541,Hypothalamic glutamate neurotransmission is unrelated to energy balance.,refuted
scifact_537,Hypocretin neurones suppress panicprone state in rats.,refuted
scifact_531,Human embryonic stem cells have the capacity to give rise to differentiated progeny representative of all three embryonic germ layers.,supported
scifact_566,"In S. cerevisiae, the absence of RNA surveillance pathways reduces sensitivity to high iron conditions.",refuted
scifact_565,"In S. cerevisiae, the absence of RNA surveillance pathways causes sensitivity to high iron conditions.",supported
scifact_1211,The density of cytokine receptor bearing cells has no effect on the distance over which cytokines act.,refuted
scifact_1210,The density of cytokine receptor bearing cells affects the distance over which cytokines act.,supported
scifact_1209,The deamination of cytidine to uridine on the minus strand of viral DNA can inactivate the viral genome by inducing G-to-A mutations.,supported
scifact_1205,The combination of physical examinations with C-reactive protein values do not improve the accuracy of radiographic verified pneumonia predictions.,refuted
scifact_1184,The US health care system can save up to $5 billion if 7% of patients waiting for kidney transplants participate in the optimized national kidney paired donation program.,refuted
scifact_1182,The Snf1 complex regulates carbon and energy metabolism in baker's yeast (Saccharomyces cerevisiae).,supported
scifact_1181,The RANK-RANK-Ligand (RANKL) pathway is involved in the development of Aire-expressing medullary thymic epithelial cells (mTECs).,supported
scifact_564,"In British Men, haplogroup I increases risk of cardiovascular disease by 50%.",supported
scifact_563,"In British Men, haplogroup I decreases risk of cardiovascular disease.",refuted
scifact_594,Incidence of heart failure increased by 10% in women since 1979.,refuted
scifact_592,Incidence of 10/66 dementia is lower than the incidence of DSM-IV dementia.,refuted
scifact_591,Incidence of 10/66 dementia is higher than the incidence of DSM-IV dementia.,supported
scifact_590,"In young and middle-aged adults, current or remote uses of ADHD medications increase the risk of serious cardiovascular events.",refuted
scifact_584,"In rhesus macaques, daily subcutaneous injections of tenofovir protects against rectally transmitted simian-human immunodeficiency virus.",supported
scifact_580,"In pediatric tissue, most T cells are naive T cell emigrants from the thymus.",supported
scifact_579,"In patients with congenital heart defects, β-blockers significantly improve clinical heart failure outcomes.",refuted
scifact_576,"In melanoma, anti-CTLA-4 treatment reinvigorates exhausted PD-1+Eomes+CD8 T cells.",supported
scifact_571,"In breast cancer, the loss of myoepithelial cells slows the transition of ductal carcinoma in situ to invasive carcinoma.",refuted
scifact_570,"In breast cancer, the loss of myoepithelial cells promotes the transition of ductal carcinoma in situ to invasive carcinoma.",supported
scifact_568,"In a naive state, blocking Wingless-Int-1 secretion from mouse embryonic stem cells inhibits self-renewal of the mouse embryonic stem cells.",supported
scifact_1177,"The PRDM1 gene, when combined with the PRDM14 gene, plays an important role during primordial germ cell specification.",supported
scifact_1176,The PRDM1 gene is a key determinant of primordial germ cells.,supported
scifact_1173,The PDPN gene deactivates the C-type lectin receptor (CLEC-2).,refuted
scifact_1171,The NF-κB essential modulator gene prevents intestinal inflammation by inhibiting receptor-interacting protein (RIP) kinase 1 kinase activity-mediated epithelial cell death.,supported
scifact_600,Including pharmacists in rounding teams does not alter the incidence of adverse drug events (ADEs).,refuted
scifact_595,Incidence of sepsis has fallen substantially from 2009 to 2014.,refuted
scifact_624,Induced hepatic stem cells possess the potential to differentiate into cholangiocytic cells.,supported
scifact_621,Individuals with Alzheimers who participate in six months of physical activity improve cognitive function for up to 18 months.,supported
scifact_615,Increased microtubule acetylation worsens interference of axonal transport caused by LRRK2 Roc-COR domain mutations.,refuted
scifact_614,Increased microtubule acetylation repairs interference of axonal transport caused by LRRK2 Roc-COR domain mutations.,supported
scifact_612,Increased microtubule acetylation exacerbates LRRK2 Roc-COR domain mutation induced locomotor deficits.,refuted
scifact_607,Increased diastolic blood pressure (DBP) is associated with abdominal aortic aneurysm.,supported
scifact_603,Increased LDL receptors plays a role in the reduction of plasma Lp(a).,supported
scifact_601,Including pharmacists in rounding teams reduces the incidence of adverse drug events (ADEs).,supported
scifact_647,Integrated care is ineffective at tackling multiple comorbidities.,refuted
scifact_646,Intake of folic acid (FA) and vitamin B6 (VB6) reduces levels of homocysteine.,supported
scifact_645,Intake of folic acid (FA) and vitamin B6 (VB6) increases levels of homocysteine.,refuted
scifact_643,Insulin effects appetite via ventral tegmental neurons.,supported
scifact_640,"Inside the body, falciparum parasites reproduce asexually.",supported
scifact_635,Inhibiting glucose-6-phospate dehydrogenase improves lipogenesis by deactivating LKB1-AMPK signaling.,refuted
scifact_633,Inhibiting focal adhesion formation increases the rate at which cells convert mechanical strain into inflammation and fibrosis.,refuted
scifact_632,Inhibiting focal adhesion formation enables cells to convert mechanical strain into eventual scarring.,refuted
scifact_631,Inhibiting HDAC6 increases survival of mice with ARID1A mutated tumors.,supported
scifact_626,Induction of urokinase receptor signaling in podocytes causes foot process effacement and proteinuria.,supported
scifact_625,Induced hepatic stem cells possess the potential to differentiate into hepatocytic cells.,supported
scifact_1170,The NF-κB essential modulator gene induces intestinal inflammation by promoting receptor-interacting protein (RIP) kinase 1 kinase activity-mediated epithelial cell death.,refuted
scifact_1169,The M2-phenotype in brown adipose tissue macrophages increases brown adipose tissue thermogenic activity.,supported
scifact_1162,The DdrB protein from Deinococcus radiodurans functions as a pentamer.,supported
scifact_1159,The DESMOND program demonstrates no significant impact on weight loss.,supported
scifact_1158,The DESMOND program demonstrates no significant impact on lifestyles outcomes.,supported
scifact_1157,The DESMOND program demonstrates no significant impact on biochemical outcomes.,supported
scifact_1156,The DESMOND program caused substantial weight loss in most participants.,refuted
scifact_648,Integrated care is successful at tackling multiple comorbidities.,supported
scifact_668,Klf4 is important for proper myeloid cell differentiation.,supported
scifact_667,Klf2 is important for proper myeloid cell function.,supported
scifact_666,Kir7.1 modulates channel activity by the G protein-coupled melanocortin-4 receptor (MC4R) in the paraventricular nucleus of the hypothalamus.,supported
scifact_665,KRT17 modulates the expression of the transcriptional regulator AIRE in diseased epithelia.,supported
scifact_663,KLF4 is necessary for VSMCs to gain genetic characteristics of other cell types within atherosclerotic lesions.,supported
scifact_662,JMJD6 slows the hydroxylation of C-terminal lysine,refuted
scifact_661,JMJD6 catalyzes the hydroxylation of C-terminal lysine and supresses transcriptional activity.,supported
scifact_657,Intramembrane cleavage by signal peptide peptidase aids in the degradation of proteins with a complex membrane orientation.,supported
scifact_653,Interleukin-18 plays an important role in the pathogenesis of atherosclerosis.,supported
scifact_683,Lack of FGF21 in mice slows the rate of atherosclerotic plaque formation.,refuted
scifact_682,Lack of FGF21 in mice leads to reduced lifespan.,supported
scifact_681,Lack of FGF21 in mice leads to atherosclerotic plaque formation.,supported
scifact_680,Lack of FGF21 in mice increases life expectancy.,refuted
scifact_673,LDL cholesterol has a causal role in the development of cardiovascular disease.,supported
scifact_671,Knockout proximal tubule-specific deletion of the BMP receptor Alk3 causes fibrosis.,supported
scifact_670,Knockout proximal tubule-specific deletion of the BMP receptor Alk3 causes epithelial damage.,supported
scifact_669,Klf4 is not required for proper myeloid cell differentiation.,refuted
scifact_1148,Ten percent (10%) of kidney cancers in the UK are attributable to excess weight.,supported
scifact_1145,Taxation of sugar-sweetened beverages reduced the incidence rate of type II diabetes in India.,supported
scifact_1142,Taking anti-depresents is associated with a decrease in the Aβ level in the brain of experimental animals.,supported
scifact_1141,Taking 400mg of α-tocopheryl acetate in combination with vitamin C reduces the risk of prostate cancer.,refuted
scifact_1139,Taking 400mg of α-tocopheryl acetate does not prevent prostate cancer.,supported
scifact_1138,TRAP+ osteoclasts regulate mature osteoblast maintenance.,supported
scifact_1136,TNFAIP3 is a tumor enhancer in glioblastoma.,supported
scifact_1135,TNFAIP3 is a glioblastoma tumor suppressor.,refuted
scifact_694,Lice attenuated SIV vaccines induce a stronger antigen-specific T cell response in lymph node cells.,supported
scifact_738,MICAL redox enzymes regulate actin dynamics.,supported
scifact_737,MICAL redox enzymes regulate actin dynamics in many cell types.,supported
scifact_736,MFGE8 regulates fat absorption by binding to av-Beta3 and av-Beta5 integrins.,supported
scifact_734,MEK inhibitors are effective treatments in RAS-driven mouse models of cancer.,supported
scifact_726,Ly6C hi monocytes have a higher inflammatory capacity than Ly6C lo monocytes.,supported
scifact_724,Ly49Q directs the organization of neutrophil polarization by regulating membrane raft functions.,supported
scifact_717,Low nucleosome occupancy correlates with high methylation levels across species.,supported
scifact_709,Long chain polyunsaturated fatty acids supplementation is associated with lower rates of atopic eczema at 1 year.,supported
scifact_1153,The C-type lectin receptor (CLEC-2) rearranges the actin cytoskeleton in dendritic cells to promote efficient motility along stromal surfaces.,supported
scifact_764,Medications to treat obesity are highly effective.,refuted
scifact_760,Mathematical models predict that using Artemisinin-based combination therapy over nongametocytocidal drugs have only a modest impact in reducing malaria transmission.,supported
scifact_752,Major vault protein regulates sorting of tumor suppressive miR-193a into EVs.,supported
scifact_751,Major vault protein (MVP) leads to more aggressive tumors by regulating the sorting of tumor suppressive miR-193a into extracellular vesicles (EVs).,supported
scifact_749,Major antigen-induced signals from the T cell receptor and secondary signals from costimulatory receptors are required for T cell activation.,supported
scifact_748,MafA ubiquitination increases the recruitment of coavtivator P/CAF by MafA.,supported
scifact_747,MafA ubiquitination decreases the recruitment of coavtivator P/CAF by MafA.,refuted
scifact_746,MafA phosphorylation enhances its ubiquitination.,supported
scifact_745,MafA phosphorylation decreases its ubiquitination.,refuted
scifact_740,MUC1-C activates the NF-κB p65 signaling pathway by interacting with IκB kinase ß.,supported
scifact_1134,TNFAIP3 is a glioblastoma tumor enhancer.,supported
scifact_1133,TMEM27 is a marker for beta cells.,supported
scifact_1128,T cell receptor /CD3 microdomains are required to induce the immunologic synapse.,supported
scifact_1127,Systemic lupus erythematosus is a risk factor for cardiovascular disease.,supported
scifact_1126,Systemic immunosuppressive (IS) therapy increases the chance of cancer mortality in patients with inflammatory eye disease (IED),refuted
scifact_1125,Systemic immunosuppressive (IS) therapy does not enhance the chance of cancer mortality in patients with inflammatory eye disease (IED),supported
scifact_1120,Sympathetic nerve activity is reduced throughout normal pregnancy.,refuted
scifact_780,Mice that lack Interferon-γ or its receptor are highly susceptible to experimental autoimmune myocarditis.,supported
scifact_779,Mice lacking Sirt1 in Sf1-expressing neurons have increased susceptibility to diet-induced obesity and insulin resistance.,supported
scifact_778,Mice lacking Sirt1 in Sf1-expressing neurons are immune to diet-induced obesity and insulin resistance.,refuted
scifact_772,Mice are incapable of producing neutralizing antibodies in reponse to the Chikungunya virus (CHIKV) produced in mosquitos.,refuted
scifact_771,Metastatic colorectal cancer treated with a single agent fluoropyrimidines resulted in similar efficacy and better quality of life when compared with oxaliplatin-based chemotherapy in elderly patients.,refuted
scifact_767,Men are more susceptible to death due to pneumonia when compared to women.,refuted
scifact_766,Medications to treat obesity have unwanted side effects.,supported
scifact_765,Medications to treat obesity do not have side effects.,refuted
scifact_798,Mitochondria play a trivial role in calcium homeostasis.,refuted
scifact_797,Mitochondria play a major role in energy production.,supported
scifact_795,Mitochondria play a major role in apoptosis.,supported
scifact_792,Misunderstandings between doctors and patients can lead to non-adherence.,supported
scifact_791,Migraine with aura is associated with ischemic stroke.,supported
scifact_790,Microglia are an innate immune cell type of the peripheral nervous system.,refuted
scifact_789,Microglia are an innate immune cell type of the central nervous system.,supported
scifact_788,Microcin J25 inhibits nucleoside triphosphate (NTP) binding.,supported
scifact_787,Microcin J25 encourages nucleoside triphosphate (NTP) binding.,refuted
scifact_782,Mice without IFN-γ or its receptor are highly susceptible to EAM induced with α-MyHC/CFA.,supported
scifact_822,N348I mutations cause resistance to nevirapine.,supported
scifact_818,Myelin sheaths play a role in action potential propagation.,supported
scifact_816,Mutations in RIM1 raise levels of IME1 RNA.,refuted
scifact_815,Mutations in RIM1 decrease levels of IME1 RNA.,supported
scifact_812,Mutant mice lacking SVCT2 have severely reduced ascorbic acid levels in both brain and adrenals.,supported
scifact_810,"Mouse models can be generated using ""artificial spermatids.""",supported
scifact_807,Most termination events in Okazaki fragments are dictated by initiation patterns.,supported
scifact_804,Monoclonal antibody targeting of N-cadherin inhibits growth.,supported
scifact_803,Monoclonal antibody targeting of N-cadherin inhibits castration resistance.,supported
scifact_802,Monoclonal antibody targeting of N-cadherin encourages metastasis.,refuted
scifact_801,Monoclonal antibody targeting of N-cadherin encourages castration resistance.,refuted
scifact_856,Nonsteroidal antinflammatory drugs are ineffective as cancer treatments.,refuted
scifact_855,Noninvasive positive pressure ventilation is not predictive of acute respiratory failure after solid organ transplantation.,refuted
scifact_854,Nonhypertensive people who are 55 years old have a 90% chance of developing hypertension during their lifetime.,supported
scifact_853,Nonhuman primates are incapable of producing neutralizing antibodies in reponse to the Eilat virus (EILV) produced in mosquitos.,refuted
scifact_846,Neutrophils produce IL-1β in response to large particles.,supported
scifact_844,Neutrophil extracellular trap (NET) antigens may contain the targeted autoantigens PR3 and MPO.,supported
scifact_841,Natriuretic peptides protect against diabetes.,supported
scifact_840,Natriuretic peptides increase susceptibility to diabetes.,refuted
scifact_835,NR5A2 does not play a role in development of endometrial tissues.,refuted
scifact_825,N348I mutations reduce resistance to nevirapine.,refuted
scifact_883,Omnivores produce more trimethylamine N-oxide from dietary I-carnitine than vegans.,supported
scifact_881,Omnivores produce less trimethylamine N-oxide from dietary I-carnitine than vegans.,refuted
scifact_867,Oat tolerant coeliac patients may have oat specific inflammatory cells in their small bowel mucosa.,supported
scifact_863,Notch signaling occurs between tumor cells and stromal cells.,supported
scifact_861,Normal granulomas form in the presence of TNF in Zebrafish.,refuted
scifact_860,Normal granulomas form in the absence of TNF in Zebrafish.,supported
scifact_858,Normal expression of RUNX1 causes tumorsupressing effects.,supported
scifact_857,Nonsteroidal antinflammatory drugs show potential anticancer indications.,supported
scifact_1119,Sympathetic nerve activity is elevated throughout normal pregnancy.,supported
scifact_1115,Surgical treatment is not superior to non-surgical in treating adults with displaced fractures of the proximal humerus.,supported
scifact_1114,"Surfactin producing cells and exopolymer producing cells cooperate to generate ""Van Gogh"" bundles that have sliding abilities on specialized media.",supported
scifact_885,One in five surgical randomized controlled trials are discontinued early.,supported
scifact_884,Omnivores produce more trimethylamine N-oxide from dietary I-carnitine than vegetarians.,supported
scifact_917,PTEN is a regulator for the transcriptional activity of SRF,supported
scifact_912,PKG-la plays an essential role in expression of spinal long term potentiation in PGK-la knockout mice.,supported
scifact_910,PKG-la does not have a large impact on expression of spinal long term potentiation in PGK-la knockout mice.,refuted
scifact_909,PKG-la does not have a large impact on expression of pain hypersensitivity in PGK-la knockout mice.,refuted
scifact_902,PD-1 triggering on monocytes enhances IL-10 production by monocytes.,supported
scifact_901,PCSK9 inhibitors decrease plasma Lp(a) levels.,supported
scifact_893,Osteocytes have an essential role in G-CSF induced HSPC mobilization.,supported
scifact_886,One in two surgical randomized controlled trials are discontinued early.,refuted
scifact_1106,Students who perform poorly in the early years of medical school are less likely to commit professional misconduct later in their careers.,refuted
scifact_1105,Students who perform poorly in the early years of medical school are at increased risk for professional misconduct later in their careers.,supported
scifact_1103,Stroke patients with prior use of direct oral anticoagulants have a higher risk of in-hospital mortality than stroke patients with prior use of warfarin.,refuted
scifact_1102,Stiff substrates inhibit mesodermal differentiation by degrading beta-catenin in an integrin-dependent manner.,supported
scifact_1101,Stiff substrates encourage mesodermal differentiation by degrading beta-catenin in an integrin-dependent manner.,refuted
scifact_925,Patients in stable partnerships progress from HIV to death at the same rate as patients not in partnerships.,refuted
scifact_923,Patients in stable partnerships have a slower progression from HIV to AIDS.,supported
scifact_919,Participants who quit smoking reduce lung cancer risk by approximately 50%.,supported
scifact_935,Peroxynitrite is required for induction of T cell tolerance.,supported
scifact_933,Pediatric SCD patients with vaso-occlusive crisis show increased morphine use after breathing 80 ppm iNO for 4 hours.,supported
scifact_930,Patients with panic anxiety show decreased CSF levels of hypocretin.,refuted
scifact_929,Patients with microcytosis and higher erythrocyte count were more resistant to severe malarial anaemia when infected with Plasmodium falciparum.,supported
scifact_928,Patients with microcytosis and higher erythrocyte count are more vulnerable to severe malarial anaemia when infected with Plasmodium falciparum.,refuted
scifact_927,Patients with common epithelial cancers are less likely to have an emergency event as their first hospital admission if they live in resource-deprived areas.,refuted
scifact_926,Patients with common epithelial cancers  are more likely to have an emergency event as their first hospital admission if they live in resource-deprived areas.,supported
scifact_1109,Suboptimal nutrition is a leading cause of premature death,supported
scifact_953,Pioglitazone use is significantly associated with an increased risk of pancreatic cancer.,supported
scifact_952,Pioglitazone use is not associated with an increased risk of prostate cancer.,refuted
scifact_951,Piezo1 channels are sensors for cell migration in epithelial cells.,supported
scifact_944,Physical activity does not improve cognitive function in individuals with Alzheimers.,refuted
scifact_942,Phase information is useful for predicting donor-recipient matches in organ transplantation.,supported
scifact_941,Pharmacist attendance at ward rounds reduces adverse events in wards.,supported
scifact_940,Pharmacist attendance at ward rounds increases adverse events in wards.,refuted
scifact_972,Primary cervical cancer screening with HPV detection has lower longitudinal sensitivity than conventional cytology to detect cervical intraepithelial neoplasia grade 2.,refuted
scifact_965,Prescribed exercise training improves quality of life.,supported
scifact_964,Pre-mRNAs associated with spliceosomal components are more stable than unassociated splicing substrates.,supported
scifact_963,Pre-mRNAs associated with spliceosomal components are less stable than unassociated splicing substrates.,refuted
scifact_962,Post-transcriptional handling of mitochondrial transcripts occurs in mitochondrial RNA granules.,supported
scifact_959,Polymeal nutrition increases cardiovascular mortality.,refuted
scifact_955,Pioneer factor OCT3/4 interacts with major chromatin remodeling factors.,supported
scifact_954,Pioglitazone use is significantly associated with an increased risk of prostate cancer.,supported
scifact_979,Progerin induces premature aging in stem cells.,supported
scifact_977,Pro-inflammatory cytokines are up regulated during tumor development.,supported
scifact_973,Primary cervical cytology screening with HPV detection has higher longitudinal sensitivity to detect severe cervical intraepithelial neoplasia than conventional cytology.,supported
scifact_1003,RAD52 is involved in break-induced DNA replication (BIR).,supported
scifact_1000,Pyridostatin stabilizes the G - quadruplex in the telomeric region.,supported
scifact_999,Pyridostatin reduces proliferation of homologous recombination - defective cells.,supported
scifact_998,Pyridostatin prevents double-strand breaks accumulation.,refuted
scifact_997,Pyridostatin induces double-strand breaks accumulation.,supported
scifact_996,Pyridostatin induces checkpoint activation.,supported
scifact_994,Pyridostatin encourages proliferation of homologous recombination - defective cells.,refuted
scifact_992,Pyridostatin deregulates G2/M progression.,supported
scifact_990,Pyridostatin decreases telomere fragility in BRCA2-deficient cells.,refuted
scifact_984,Pseudogene PTENP1 encodes a transcript that regulates PTEN expression.,supported
scifact_980,Propriospinal interneurons that play a role in the plastic reorganization of spinal circuits are integral for recovery from spinal cord injury.,supported
scifact_1097,Splenomegaly is observed in knockin mouse lacking the SHP-2 MAPK pathway.,supported
