claim_id,claim,true_label
scifact_1090,Smc5/6 engagment halts the activation of SUMO E3 ligase Mms21 by ATP-dependent remolding.,refuted
scifact_1087,Sildenafil worsens erectile function in men who experience sexual dysfunction as a result of the use of SSRI antidepressants.,refuted
scifact_1084,Side effects associated with antidepressants increases risk of stroke.,supported
scifact_1081,Side effects associated with antidepressants do not represent a mortality risk to postmenopausal women.,refuted
scifact_1073,Sepsis related mortality has risen from 2009 to 2014.,refuted
scifact_1072,Sepsis related mortality has remained stable between 2009-2014.,supported
scifact_1004,RANK-RANKL pathway signalling has no known association with development of Aire-expressing medullary thymic epithelial cells.,refuted
scifact_1011,Radioiodine treatment of non-toxic multinodular goitre increases thyroid volume.,refuted
scifact_1009,RUNX1 is downregulated or mutated in TLX1 T-ALL.,supported
scifact_1006,RTEL1 interacts with TRF2 through a C4C4 motif,supported
scifact_1005,RANK-RANKL pathway signalling is linked to development of Aire-expressing medullary thymic epithelial cells.,supported
scifact_1043,Retinoic acid receptor-related orphan receptor gamma (RORγ) is a therapeutic target for castration-resistant prostate cancer (CRPC),supported
scifact_1042,Repressing IL-18 has negative effects on atherosclerotic lesion composition and progression.,refuted
scifact_1040,Replacement of histone H2A with H2A.Z accelerates gene activation in yeasts by destabilizing +1 nucleosomes.,supported
scifact_1036,Removal of H3K9me3 improves reprogramming efficiency in human somatic cell nuclear transfer experiments.,supported
scifact_1035,Removal of H3K9me3 by ectopic expression of other H3K9 demethylases improves reprogramming efficiency in SCNT experiments.,supported
scifact_1034,Removal of H3K9me3 by ectopic expression of other H3K9 demethylases decreases reprogramming efficiency in SCNT experiments.,refuted
scifact_1031,Reduction of Rpl38 alters the composition of the Hox gene mRNAs translation in mice without lowering overall protein synthesis.,supported
scifact_1030,Reducing H3k4me3 methylation induces mouse epiblast stem cells to naive pluripotency efficiently.,supported
scifact_1028,Reduced responsiveness to interleukin-2 in regulatory T cells is associated with autoimmune diseases such as Type 1 Diabetes.,supported
scifact_1023,Recognition of start codons depends on the translation initiation factor IF3.,supported
scifact_1018,Rapid phosphotransfer rates are correlated with histidine kinase regulator specificity.,supported
scifact_1015,Rapamycin delays aging in fruit flies.,supported
scifact_1381,YAP/TAZ is required in intestinal regeneration in mouse models of ulcerative colitis.,supported
scifact_1380,Women with a lower birth weight are more likely to develop breast cancer later in life.,refuted
scifact_1378,Women are more susceptible to death due to pneumonia when compared to men.,supported
scifact_1376,Whole brain radiotherapy increases the occurrence of new brain metastases.,refuted
scifact_1373,Walking in traffic areas in London improves lung function in elderly adults.,refuted
scifact_22,76-85% of people with severe mental disorder receive no treatment in low and middle income countries.,supported
scifact_1386,cSMAC formation represses weak ligand signalling.,refuted
scifact_1390,mcm 5 s 2 U is required for proper decoding of NNR codons in eukaryotes.,supported
scifact_1391,miR-142-5P is a known regulator of raised body temperature.,supported
scifact_1392,miR-142-5P is a temperature-sensitive microRNA (miRNA).,supported
scifact_1393,miRNAs enforce homeostasis by suppressing low-level ''leaky'' transcription.,supported
scifact_1403,siRNA knockdown of A20 accelerates tumor progression in an in vivo murine xenograft model.,refuted
scifact_1406,β-sheet opening occurs during pleurotolysin pore formation.,supported
scifact_1402,r-protein chaperones are found in complexes with their r-protein binding partners.,NEI
scifact_1401,qSOFA scores are associated with length of stay in emergency department patients.,NEI
scifact_1400,p75 NTR - associated cell death executor (NADE) interacts with the p75 NTR death domain,NEI
scifact_1398,p16INK4A degradation is encoded by CDKN2A.,NEI
scifact_1397,p16INK4A degradation is  linked to an abnormal wound response caused by the microinvasive step of advanced Oral Potentially Malignant Lesions (OPMLs).,NEI
scifact_1394,miRNAs regulate a unique suite of mRNAs to maintain homeostasis in cells.,NEI
scifact_1387,"eRNAs influence is linked to senescence, aging, and carcinogenesis.",NEI
scifact_27,A 100g dose of chloroquine chemoprophylactic regimen results in retinal toxicity after 5-6 years of weekly intake.,NEI
scifact_26,A 100g dose of chloroquine chemoprophylactic regimen results in retinal toxicity after 1 year of weekly intake.,NEI
scifact_25,90% of sudden infant death syndrome (SIDS) deaths happen in newborns aged less than 6 months.,NEI
scifact_24,90% of patients with melanoma and an objective response to PD-1 blockade will experience a progression in their melanoma.,NEI
scifact_21,70% of burn patients are admitted for hospitalization and further treatment after appearing at hospital emergency wards or outpatient clinics.,NEI
scifact_20,7-day-old adult Caenorhabditis elegans exhibit approximately 75% of the learning capacity seen in 1-day old adults.,NEI
scifact_19,7-day-old adult Caenorhabditis elegans exhibit approximately 5% of the learning capacity seen in 1-day old adults.,NEI
scifact_18,61% of colorectal cancer patients are diagnosed with regional or distant metastases.,NEI
scifact_17,53% of perinatal mortality is due to low birth weight.,NEI
scifact_15,50% of patients exposed to radiation have activated markers of mesenchymal stem cells.,NEI
scifact_14,5'-nucleotidase metabolizes 6MP.,NEI
scifact_1070,Self-advocacy training is effective at decreasing homelessness.,NEI
scifact_1068,ScPif1p has reduced binding ability to G-rich ssDNA compared to non-G-rich ssDNA.,NEI
scifact_1067,ScPif1p has higher binding ability to G-rich ssDNA than to non-G-rich ssDNA.,NEI
scifact_1058,Roughly 55% of women with chronic pelvic pain have no underlying pathology.,NEI
scifact_1053,Rising temperatures caused by global warming lowers the risk of dengue fever transmission.,NEI
scifact_1052,Rising temperatures caused by global warming increases risk of dengue fever transmission.,NEI
scifact_1047,Ribosome-inactivating protein-2 (RIP-2) interacts with the p75 NTR death domain,NEI
scifact_1046,Ribosomal protein (RP) expression is controlled in part by stress-activated regulators.,NEI
scifact_1038,Replacement of OCT4 and SOX2 genes with GATA3 is not capable of reprogramming human cells.,NEI
scifact_1037,Replacement of OCT4 and SOX2 genes with GATA3 has the ability to reprogram human cells.,NEI
scifact_1033,Reduction of purity of cytoplasmic membranes isolated from overexpressors is indicated by stronger spots for OmpF in 2D BN-PAGE gels.,NEI
scifact_1032,Reduction of purity of cytoplasmic membranes isolated from overexpressors is indicated by stronger spots for OmpA in 2D BN-PAGE gels.,NEI
scifact_1027,Reduced phosphorylation of PP2A suppresses HDAC4 dephosphorylation.,NEI
scifact_1026,Reduced phosphorylation of PP2A increases HDAC4 dephosphorylation by enhancing PP2A-HDAC4 interaction.,NEI
scifact_1025,Reduced levels of lipolysis leads to higher P38 phosphorylation in adipose tissue.,NEI
scifact_1016,Rapamycin increases the concentration of triacylglycerols in fruit flies.,NEI
scifact_1008,RUNX is not expressed in skin tissue.,NEI
scifact_1096,Specialized functional cell types can be derived from human pluripotent stem cells.,NEI
scifact_1091,Sn is present on mature DCs during inflammation in vivo.,NEI
scifact_1085,Side effects associated with antidepressants lower risk of myocardial infarction.,NEI
scifact_1075,Sequence conservation in gene regulatory regions between species is a poor predictor of conserved functionality.,NEI
scifact_1074,Sequence conservation in gene regulatory regions between species is a high-accuracy predictor of conserved functionality.,NEI
scifact_1002,RA activation of DIF2 and NB4 cells induces hallmarks of transcriptionally active promoters.,NEI
scifact_1001,R2D2 stops miRNA production by increasing the selectivity of Dcr2 for long dsRNA.,NEI
scifact_989,"Pure neural progenitor cell (NPC) populations can only be obtained from cell cultures that undergo passaging, filtration, or other isolation and cell sorting methods.",NEI
scifact_988,Pseudoknots are not evolutionarily conserved in most eukaryotes.,NEI
scifact_978,Pro-inflammatory cytokines are up repressed during tumor development.,NEI
scifact_976,Primary pro-inflammatory cytokines suppress secondary pro- and anti-inflammatory mediators.,NEI
scifact_970,PrimPol generates short DNA replication intermediates on the leading strand during DNA replication.,NEI
scifact_969,PrimPol degrades short DNA replication intermediates on the leading strand during DNA replication.,NEI
scifact_949,Physical injury represses transgultaminase activity.,NEI
scifact_946,Physical activity level is associated with the difference in maximal oxygen consumption between black and white youth.,NEI
scifact_945,Physical activity level has no association with the difference in maximal oxygen consumption between black and white youth.,NEI
scifact_939,Persistor cells are one reason for incomplete responses to Tyrosine kinase inhibitor (TKI) therapy in cancer patients.,NEI
scifact_938,Persister cells provide relapse resistance in cancer patients.,NEI
scifact_934,Perigenital skin is not the primary site of HIV acquisition.,NEI
scifact_1111,Sudden death can occur in patients with complex ventricular arrhythmias.,NEI
scifact_1098,Stacking is more stable when a purine is present in the +5 position (C1698).,NEI
scifact_916,PRC1-bound plasmids sediment at a slower rate in unbound plasmids than in sucrose gradients.,NEI
scifact_908,PGE 2 suppresss intestinal tumor growth by altering the expression of tumor suppressing and DNA repair genes.,NEI
scifact_900,Oxidative phosphorylation is one of the primary glycometabolic pathways in cells.,NEI
scifact_899,Oxidative DNA damage inhibits STING signalling.,NEI
scifact_898,Oxidative DNA damage activates STING signalling.,NEI
scifact_897,Overexpressing Cnp1 N-tail variants rescues the temperature-sensitive growth defect of scm3-139.,NEI
scifact_896,Overexpressing Cnp1 N-tail variants exacerbates the temperature-sensitive growth defect of scm3-139.,NEI
scifact_895,Over half of the gabonese children with Schimmelpenning-Feuerstein-Mims syndrome (SFM) had a plasma lactate of more than 5mmol/L.,NEI
scifact_894,"Osteoparthritis (OA) is characterized by degeneration of articular cartilage, joint edge, and subchondral bone hyperplasia.",NEI
scifact_891,Origin gross domestic product(GDP) is positively related to dengue virus (DENV-1) diffusion in air traffic shipments.,NEI
scifact_890,Origin gross domestic product(GDP) is negatively related to dengue virus (DENV-1) diffusion in air traffic shipments.,NEI
scifact_1118,Sweet taste receptors on the tongue are deactivated by between 1 and 10 mM glucose.,NEI
scifact_1112,Sudden death can occur in patients with orthostatic hypertension without cardiac conduction abnormalities.,NEI
scifact_877,Occipital activation levels are associated with auditory spatial performance in parietal regions of the brain.,NEI
scifact_876,Obesity raises life quality.,NEI
scifact_871,Obesity decreases life quality.,NEI
scifact_866,Nuclear transfer from adult human fibroblasts to human oocytes can give rise to blastocysts containing expandable pluripotent cells.,NEI
scifact_848,Nigerian physicians constitue the largest component of sub-Saharan Africa-trained physicians in the United States.,NEI
scifact_838,NR5A2 is important in reverse cholesterol transport in humans.,NEI
scifact_828,NAC inhibits the generation of angiotensin-converting enzyme.,NEI
scifact_826,NAC destabilizes NO to increase the effect of contrast agents on renal functions.,NEI
scifact_817,Myelin sheaths are lipid-rich cellular structures.,NEI
scifact_813,"Mutations in G-Beta protein GNB1 are present in many cancers, resulting in loss of interaction with G-alpha subunits and concomitant activation of AKT pathway.",NEI
scifact_799,Moderate consumption of candy and chocolate reduces the risk of cardiovascular disease (CVD).,NEI
scifact_777,Mice defective for deoxyribonucleic acid (DNA) polymerase m (polm) reveal increased sensitivity to ionizing radiation (IR).,NEI
scifact_776,Mice defective for deoxyribonucleic acid (DNA) polymerase m (polm) fail to reveal increased sensitivity to ionizing radiation (IR).,NEI
scifact_774,Mice defective for deoxyribonucleic acid (DNA) polymerase I (polI) fail to reveal increased sensitivity to ionizing radiation (IR).,NEI
scifact_762,Measuring routine outcomes is more beneficial to clinical practice than assessing treatment adherence.,NEI
scifact_761,MeCP2 influences the synaptic maturation of neurons.,NEI
scifact_758,Marmosets have a brain region homologous to Broca's area.,NEI
scifact_757,Many transmembrane receptors transmit signals by long-range conformational changes in the association of alpha-helices across the plasma membrane.,NEI
scifact_755,Many cytokines that are produced by cancer cells also contribute to carcinogenesis.,NEI
scifact_753,Malaria has a high vectorial capacity.,NEI
scifact_739,MT binding domain drives amyloid structure formation.,NEI
scifact_733,M. stadtmanae induces ASC speck formation in BlaER1 monocytes.,NEI
scifact_732,M. stadtmanae does not induce ASC speck formation in BlaER1 monocytes.,NEI
scifact_730,Lysine histone demethylase inhibitor JIB 04 is inactive against KDM5A.,NEI
scifact_714,Low expression of miR7a does not repress target genes or exert a biological function in testis.,NEI
scifact_713,Low expression of miR7a does not repress target genes or exert a biological function in ovaries.,NEI
scifact_710,Long chain polyunsaturated fatty acids supplementation reduces wheezing and asthma.,NEI
scifact_705,Long chain polyunsaturated fatty acids supplementation has no significant effects on wheezing or asthma at 3 and 6 years.,NEI
scifact_704,Long - range chromatin interactions regulate transcription.,NEI
scifact_703,Localization of PIN1 in the roots of Arabidopsis requires VPS9a,NEI
scifact_698,Lmna knock-in models are appropriate for testing therapeutic approaches against Hutchinson-Gilford progeria syndrome (HGPS).,NEI
scifact_696,Lipopolysaccharides have an inflammation independent effect on kidney barrier function.,NEI
scifact_689,Less than 10% of patients exposed to radiation have activated markers of mesenchymal stem cells.,NEI
scifact_688,Lamins have no effect on nuclear membrane structure maintenance.,NEI
scifact_687,Lamins are found within the inner layer of the nuclear membrane of all cells.,NEI
scifact_686,Lamins are found within the inner layer of the mitochondrial membrane of all cells.,NEI
scifact_685,Lamins are associated with nuclear membrane structure maintenance.,NEI
scifact_679,LSD1-positive promoters are associated with RNA polymerase II,NEI
scifact_677,LRBA promotes CTLA - 4 recycling.,NEI
scifact_676,LRBA prevents CTLA - 4 recycling.,NEI
scifact_672,L3MBTL2 binds to H2AK119Ub marked chromatin to form a PRC1 complex.,NEI
scifact_658,It is not proven that moderate consumption of candy and chocolate reduces the risk of cardiovascular disease (CVD) specifically.,NEI
scifact_655,Intra-cerebroventricular infusion of amyloid-β oligomers reduces expression of fibronectin type-III domain-containing protein 5 mRNA in mice hippocampi.,NEI
scifact_654,Intra-cerebroventricular infusion of amyloid-β oligomers increases expression of fibronectin type-III domain-containing protein 5 mRNA in mice hippocampi.,NEI
scifact_652,"Interferon stimulated genes (ISGs) Irf1, Irg1, Ifi27, and Rsad2 inhibit West Nile virus replication in cortical neurons.",NEI
scifact_651,"Interferon stimulated genes (ISGs) Irf1, Irg1, Ifi27, and Rsad2 encourage West Nile virus replication in cortical neurons.",NEI
scifact_1168,The HSV-2 infection is typically asymptomatic.,NEI
scifact_1166,The H2A-H2B eviction defect is compensated for by other histone chaperone(s).,NEI
scifact_1165,The G34R/V mutation does not create a hypomethylated phenotype at the H3K36 histone.,NEI
scifact_1164,The G34R/V mutation creates a hypomethylated phenotype at the H3K36 histone.,NEI
scifact_1161,The DEXI promoter region is bound by multiple transcription factors in a murine haematopoietic progenitor cell line.,NEI
scifact_650,Integrating classroom-based collaborative learning with Web-based collaborative learning offers the best class performance.,NEI
scifact_642,Insulin decreases risk of severe kidney failure.,NEI
scifact_638,Input from  mental and physical health care professionals is not effective at decreasing homelessness.,NEI
scifact_622,Individuals with low serum vitamin D concentrations have decreased risk of multiple sclerosis.,NEI
scifact_620,Increased vessel density along with a reduction in fibrosis improves the efficacy of chemotherapy treatments.,NEI
scifact_618,Increased purity of cytoplasmic membranes isolated from overexpressors is indicated by stronger spots for OmpF in 2D BN-PAGE gels.,NEI
scifact_617,Increased mobility of retrotransposons is assosciated with mutation and higher tumorigenesis rates.,NEI
scifact_616,Increased mobility of retrotransposons does not lead to mutation and higher tumorigenesis rates.,NEI
scifact_611,Increased lipolysis leads to higher P38 phosphorylation in adipose tissue.,NEI
scifact_610,Increased flux of microbial products suppresses immune responses.,NEI
scifact_609,Increased flux of microbial products provokes immune responses.,NEI
scifact_606,Increased conversion of PGE 2 to PPARy ligand 15-ket-PGE 2 causes accumulation of PGE.,NEI
scifact_602,Increase of p62 in prostate tumor stroma results in defective autophagy.,NEI
scifact_1178,The PRR MDA5 has a C-terminal domain.,NEI
scifact_1174,The PPR MDA5 has twenty N-terminal CARD domains.,NEI
scifact_588,"In transgenic mice harboring green florescent protein under the control of the Sox2 promoter, more than 50 percent of the cells with green florescent colocalize with cell proliferation markers.",NEI
scifact_585,"In the UK, drowning affects boys and girls equally.",NEI
scifact_582,"In rhesus macaques, daily subcutaneous injections of emtricitabine are ineffective at protecting against rectally transmitted simian-human immunodeficiency virus.",NEI
scifact_574,"In domesticated populations of Saccharomyces cerevisiae, segmental aneuploidy occurs infrequently.",NEI
scifact_573,"In domesticated populations of Saccharomyces cerevisiae, segmental aneuploidy is very common.",NEI
scifact_572,"In chronic viral infections or tumors, peptides that selectively inhibit PTPRS can be utilized to boost insufficient activity of pDCs.",NEI
scifact_1208,The cytokine receptor which regulates chemotaxis and formation of lymph nodes is involved in production of myeloperoxidase in the left atrium.,NEI
scifact_1206,The composition of myosin-II isoform switches from the A isoform to the B isoform during hematopoietic differentiation.,NEI
scifact_1195,The artifactual C-terminal helix swapping in the StART domain is observed in the Ups1-Mdm35 heterodimer of the StARkin superfamily.,NEI
scifact_1193,"The appearance of brown-like or beige cells primarily occurs in visceral fat, not subcutaneous fat.",NEI
scifact_1190,The amount of publicly available DNA data doubles every 10 months.,NEI
scifact_1188,The ability of activator E2Fs in preventing cell death is limited to terminally differentiated cells.,NEI
scifact_1186,The World Health Organization's (WHO) data collection process is biased downward by unequal selection of larger outbreaks.,NEI
scifact_1183,The TRaF1/C5 rs10818488 allele polymorphism regulates the neighboring C5 gene.,NEI
scifact_557,Immune complex triggered cell death leads to sequestration of oxidized mitochondrial DNA.,NEI
scifact_555,Immune complex triggered cell death leads to extracellular release of nuclear DNA.,NEI
scifact_550,ITAM phosphorylation allows for the transfer of the T cell receptor (TCR) signal from the echo-domain to the cytoplasmic tail of the T cell receptor (TCR).,NEI
scifact_545,IFIT1 speeds viral replication by allowing for the proliferation of mis-capped viral RNAs.,NEI
scifact_526,Homozygous deletion of murine Sbds gene from osterix-expressing mesenchymal stem and progenitor cells (MPCs) induces oxidative stress.,NEI
scifact_509,Hematopoietic Stem Cell purification reaches purity rates above 90%.,NEI
scifact_494,HSCT-T dosage may not be diagnostic if the onset of symptoms occurs less than 3 hours before AMI.,NEI
scifact_493,HOXB4 is a highly expressed component of cellular secretome from fetal liver cell populations.,NEI
scifact_492,HOXB4 facilitates HSC expansion when co-cultured with HSCs.,NEI
scifact_490,HNF4A mutations are associated with macrosomia in infancy.,NEI
scifact_489,HIV trans-activator protein (TAT) effectively transports large and small molecules across cellular membranes into larger populations of neurons.,NEI
scifact_487,H4 G94P proteins suppress degradation of free histones via Rad53-dependent mechanisms.,NEI
scifact_486,"H4 G94P proteins inhibit chromatin assembly, which decreases free histones.",NEI
scifact_1219,"The gene daf-16, which encodes forkhead Box O (FOXO), is required for all phenotypes associated with reduced insulin/insulin-like growth factor (Igf) signaling.",NEI
scifact_1218,The first MBT repeat of the four malignant brain tumor (4MBT) domain of Drosophila's Sfmbt and of the orthologous mammalian L3MBTL2 is required for the interaction with the spacer region of Drosophila's Pleiohomeotic (Pho) or its human ortholog YY1.,NEI
scifact_1215,The effect of Lipopolysaccharides on kidney barrier function is dependent on inflammation levels.,NEI
scifact_1214,The deregulated and prolonged activation of monocytes improves inflammatory disease outcomes.,NEI
scifact_1212,The deregulated and prolonged activation of monocytes has deleterious effects in chronic infectious conditions.,NEI
scifact_485,H4 G94P proteins induce degradation of free histones via Rad53-dependent mechanisms.,NEI
scifact_484,"H4 G94P proteins induce chromatin assembly, which increases free histones.",NEI
scifact_481,Guanine nucleotide dissociation inhibitor (Rho-GDI) interacts with the p75 NTR death domain,NEI
scifact_474,Glycan adaptation is rarely observed in the B-cell repertoire.,NEI
scifact_473,Glycan adaptation involves insertion-deletion events.,NEI
scifact_472,Glucose restriction to 0.05% reduces RLS (replicative life span) by 20-40% in S. cerevisiae.,NEI
scifact_456,Genes regulated by Esrrb transcription factor are sensitive to Mbd3 function.,NEI
scifact_449,Gastric lavage is an effective treatment for acute paraquat poisoning.,NEI
scifact_1253,The predominant localization of Linc00173 is in mononuclear macrophage nuclei.,NEI
scifact_1247,The origin of the CRF01_1b2k protein occurred between 1923 and 1956.,NEI
scifact_1244,The number of unfertilized oocytes in mated hermaphrodites increases with age.,NEI
scifact_1236,The morphology change from large white adipocytes to small brown adipocytes is a sign of increased energy expenditure potential in white adipose tissue.,NEI
scifact_1235,The morphology change from large white adipocytes to small brown adipocytes is a sign of decreased energy expenditure potential in white adipose tissue.,NEI
scifact_435,Foxp3 represses the expression of transcriptional regulators implicated in memory T cell development.,NEI
scifact_434,Foxp3 enables the expression of transcriptional regulators implicated in memory T cell development.,NEI
scifact_429,Formation of N-terminal pyroglutamate by glutamine cyclase (GC) competes with NTAQ1 for Nt-Gln substrates.,NEI
scifact_425,"For every 1,000 children with cerebral palsy, more than 300 of them are premature or underweight at birth.",NEI
scifact_423,Folate and vitamin B12 levels influence the association between homocysteine and preeclampsia.,NEI
scifact_422,Flexible molecules experience less steric hindrance in the tumor microenviroment than rigid molecules.,NEI
scifact_418,Fibroblast Growth Factor is a ligand which signals through receptor tyrosine kinases.,NEI
scifact_407,FACT and other histone chaperone(s) compensate for Histone 2A (H2A)-histone 2B (H2B) dimer eviction during the histone exchange process.,NEI
scifact_406,F4/80+ macrophages regulate mature osteoblast maintenance.,NEI
scifact_404,Expression of oncolytic virus antigens as peptides permits additional protection against relapse.,NEI
scifact_403,Expression of oncolytic virus antigens as peptides makes relapse more likely.,NEI
scifact_401,"Expression of MSX2 is induced 3 hours after the addition of BMP4, which is earlier than T and CDX2.",NEI
scifact_398,Exhaustion of B cells contributes to poor Ab response in HIV-infected individuals.,NEI
scifact_1275,The tip of the inner tube of the toxic type VI secretion system (T6SS) antibacterial effector in Escherichia coli (E. coli) is decorated with VgrG and PAAR proteins.,NEI
scifact_1257,The proportion of people with visual difficulty is two times higher in low-income countries than in high-income countries.,NEI
scifact_393,Ethanol stress reduces the expression of SRL in bacteria.,NEI
scifact_392,Ethanol stress lowers the expression of PSP in bacteria.,NEI
scifact_391,Ethanol stress increases the expression of SRL in bacteria.,NEI
scifact_390,Ethanol stress increases the expression of PSP in bacteria.,NEI
scifact_389,Ethanol stress increases the expression of IBP in bacteria.,NEI
scifact_383,Epidemiological disease burden from noncommunicable diseases is more prevalent in high economic settings.,NEI
