claim_id,claim,true_label
scifact_377,Emodin forms hydrogen bonds with residues involved in PGAM1 substrate binding.,NEI
scifact_376,Eliminating the last sporadic cases of malaria requires considerable funding.,NEI
scifact_365,ER-localized phosphatase Sac1 processes PI4P through coordination with OSBP and the endosome-localized protein sorting nexin 2.,NEI
scifact_364,EGR2 is important to myelination of the peripheral nervous system.,NEI
scifact_363,EG7 tumors can be killed by systemic oxaliplatin primed CD8+ T cells from the tumor-draining lymph node cells.,NEI
scifact_361,During the primary early antibody response activated B cells migrate toward the inner-and outer follicular areas where oxysterol accumulation is generated by stromal cells.,NEI
scifact_358,"During non-homologous end joining, the ligation step is not as tolerant of disrepairs and other distortions when joining 5' of strand breaks as compared to 3' strand breaks.",NEI
scifact_357,"During non-homologous end joining, the ligation step is not as tolerant of disrepairs and other distortions when joining 3' of strand breaks as compared to 5' strand breaks.",NEI
scifact_352,Distant CREs are less conserved among species.,NEI
scifact_351,Distant CREs are important for transcriptional regulation.,NEI
scifact_1302,Tirasemtiv has no effect on cardiac muscle.,NEI
scifact_1300,Thiopurine active metabolites can be catabolized through dephosphorylation of thioguanine nucleotides.,NEI
scifact_1291,There is no association between HNF4A mutations and diabetes risks.,NEI
scifact_345,"Differentiated E2f-1, -2, -3 TKO cells in the intestine do not exhibit apoptosis.",NEI
scifact_337,Destination container port throughput(CPT) is positively related to dengue virus (DENV-1) diffusion in air traffic shipments.,NEI
scifact_336,Destination container port throughput(CPT) is negatively related to dengue virus (DENV-1) diffusion in air traffic shipments.,NEI
scifact_326,Deletion of ATM and Rad3 related protein leads to acute tissue loss.,NEI
scifact_325,Deletion of ATM and Rad3 related protein is not predictive of acute tissue loss.,NEI
scifact_323,Deleting Raptor increases G-CSF levels.,NEI
scifact_316,Decreased conversion of PGE 2 to PPARy ligand 15-ket-PGE 2 causes accumulation of PGE.,NEI
scifact_315,Decrease of p62 in prostate tumor stroma results in defective autophagy.,NEI
scifact_313,De novo assembly of sequence data has shorter contigs than unassembled sequence data.,NEI
scifact_310,De novo assembly of sequence data has fewer specific contigs than unassembled sequence data.,NEI
scifact_1315,Transcription rates in S. cerevisiae range between 7 and 12 kb/min.,NEI
scifact_1314,Transcription rates in S. cerevisiae range between 0.7 and 2 kb/min.,NEI
scifact_1310,Traditional reviews are biased in their interpretations.,NEI
scifact_1309,Tonic signaling from the scFv prevents constitutive stimulation.,NEI
scifact_1308,Tonic signaling from the scFv is amplified by MyD88/CD40.,NEI
scifact_1307,Tonic signaling from the scFv induces constitutive stimulation.,NEI
scifact_1306,Toll-like receptor (TLR) signaling is involved in the pathogenesis of human MDS.,NEI
scifact_1304,Tirasemtiv targets cardiac muscle.,NEI
scifact_304,DMS3 protein enables Pol V transcription in vivo.,NEI
scifact_301,Cytosolic proteins bind to iron-responsive elements on mRNAs coding for TFRC1.,NEI
scifact_293,Crossover hot spots are found within gene promoters in Saccharomyces cerevisiae.,NEI
scifact_285,Continued HHV-8 transmission among MSM in San Francisco may be explained by urogenital contact.,NEI
scifact_281,Concentrations of SNV and CNV in stem-cell regulatory elements and binding sites of transcription factors in iPSC-lines are distinct from their founding cells.,NEI
scifact_262,Cis-acting lncRNAs control the expression of genes that are positioned in the vicinity of their transcription sites.,NEI
scifact_259,Chronic HIV stimulation of B cells leads to the premature exhaustion of B cells.,NEI
scifact_255,Chlamydia trachomatis is most prevalent in the UK among individuals in their 50s and 60s.,NEI
scifact_254,Chinese individuals with TT homozygosity in the MTHFR gene are more vulnerable to strokes caused by low levels of folate intake.,NEI
scifact_253,Chinese individuals with TT homozygosity in the MTHFR gene are less vulnerable to strokes caused by low levels of folate intake.,NEI
scifact_247,Chemical injury represses transglutaminase 2 activity.,NEI
scifact_1331,Tumor development occurs in conjunction with upregulation of pro-inflammatory cytokines.,NEI
scifact_1330,Tumor development occurs in conjunction with suppression of pro-inflammatory cytokines.,NEI
scifact_1325,Treatment with the EC uptake inhibitor AM404 resulted in a dose-dependent decrease in the expression of immobility.,NEI
scifact_244,Certain immunomodulator-human dialyzable leukocyte extract (hDLE) peptides are recognized by toll-like receptors (TLRs) on macrophages and dendritic cells.,NEI
scifact_229,Carriers of HNF4A mutations are at reduced risk for diabetes.,NEI
scifact_226,Cancer-associated fibroblasts (CAFs) interact with cancer cells to mediate formation and activation of CAFs.,NEI
scifact_225,Cancer-associated fibroblasts (CAFs) have no known interaction with cancer cells in the formation and activation of CAFs.,NEI
scifact_224,Cancer-associated fibroblasts (CAFs) are constituents of tumor microenvironments,NEI
scifact_214,CRP is positively correlated with postoperative mortality following Coronary Artery Bypass Graft (CABG) surgery.,NEI
scifact_211,COPI coatmer is involved in viral replication.,NEI
scifact_209,CHOP is a general endoplasmic reticulum stress marker.,NEI
scifact_205,CDK6 shows improved binding to loss-of-function variants of p18 INK4C.,NEI
scifact_204,CDK6 shows impaired binding to loss-of-function variants of p18 INK4C.,NEI
scifact_199,CCL19 is predominantly present within dLNs.,NEI
scifact_187,British male students are bullied more than British female students.,NEI
scifact_186,British female students are bullied more than British male students.,NEI
scifact_1353,Urbanization is an important risk factor related to the transmission of dengue fever.,NEI
scifact_1350,Upregulation of PD1 causes the upregulation of Satb1.,NEI
scifact_1349,Upregulation of PD1 causes the downmodulation of Satb1.,NEI
scifact_1345,Up-regulation of the p53 pathway and related molecular events speeds cancer progression.,NEI
scifact_1342,Understanding epigenetic regulation of replication is essential for the reational design of episomally replicating vectors.,NEI
scifact_182,Bone Marrow (BM) transplantation is used to treat acute myeloid leukemia (AML),NEI
scifact_176,BiP is a general endoplasmic reticulum stress marker.,NEI
scifact_175,Beta-band coherence is enhanced for visible stimuli over invisible stimuli.,NEI
scifact_174,Beta-band coherence is diminished for visible stimuli over invisible stimuli.,NEI
scifact_173,Bcp1 is a chaperone for Rpl23.,NEI
scifact_161,Bacteriophagaes MS2 and Qβ are members of the Leviviridae.,NEI
scifact_154,B3-Galectin increases cell resistance to tyrosine kinase inhibitors (TKIs) by engaging the alternate KRAS-RalB signaling complex downstream of EGFR.,NEI
scifact_153,B3-Galectin decreases cell resistance to tyrosine kinase inhibitors (TKIs) by engaging the alternate KRAS-RalB signaling complex downstream of EGFR.,NEI
scifact_139,At least 85% of patients exposed to radiation have activated markers of myofibroblasts.,NEI
scifact_134,Assessing treatment adherence is more beneficial to clinical practice than measuring routine outcomes.,NEI
scifact_126,"Approximately 250,000 people are infected with human T-cell lymphotropic virus type 1 in the United Kingdom.",NEI
scifact_1364,Venules have less significant tunica adventitia than arterioles.,NEI
scifact_96,Algerian physicians constitue the largest component of sub-Saharan Africa-trained physicians in the United States.,NEI
scifact_95,Albendazole is used to treat soil-transmitted helminths.,NEI
scifact_92,Aged patients are more susceptible to ischaemia/reperfusion injury.,NEI
scifact_91,Aged patients are less susceptible to ischaemia/reperfusion injury.,NEI
scifact_90,Adult tissue-resident macrophages stem from the embryonal yolk sac and fetal liver.,NEI
scifact_82,"Addition of BMP4, activin A, CHIR99021, and SU504 to reprogramming fibroblasts generates, expands and maintains cardiovascular progenitor cells (CPCs)",NEI
scifact_81,Acute ablation of Snail in the embryonic cortex affects the proliferation and number of embryonic cortical precursors.,NEI
scifact_80,Acute ablation of KRAS causes severe growth impairment.,NEI
scifact_74,Active H. pylori urease has a polymeric structure consisting of five distinct subunits.,NEI
scifact_73,Activator-inhibitor pairs are provided ventrally by Xrl-sizzled.,NEI
scifact_66,AZT given with ribavirin increases anemia.,NEI
scifact_64,ATM and Rad3 related protein have no role in sensing DNA damage.,NEI
scifact_63,ATM and Rad3 related protein are critical for sensing DNA damage.,NEI
scifact_62,ATF4 is a general endoplasmic reticulum stress marker.,NEI
scifact_45,A mutation in HNF4A leads to an increased risk of diabetes by the age of 14 years.,NEI
scifact_43,A low percentage of hematopoietic progenitor cells are susceptible to HIV-1 infection ex vivo.,NEI
scifact_1375,Weighed food records (WFR) result in poor completion since they're costly to run and impose high participant burden.,NEI
scifact_1374,Weighed food records (WFR) result in high completion since they're cheap to run and impose low participant burden.,NEI
scifact_37,A deficiency of vitamin B6 decreases blood levels of homocysteine.,NEI
scifact_35,A deficiency of vitamin B12 decreases blood levels of homocysteine.,NEI
scifact_11,4-PBA treatment raises endoplasmic reticulum stress in response to general endoplasmic reticulum stress markers.,NEI
scifact_10,4-PBA treatment decreases endoplasmic reticulum stress in response to general endoplasmic reticulum stress markers.,NEI
scifact_6,10% of sudden infant death syndrome (SIDS) deaths happen in newborns aged less than 6 months.,NEI
scifact_1405,taa1 tar1 tar2 triple mutants in Arabidopsis do not make root meristem during embryogenesis.,NEI
scifact_4,1-1% of colorectal cancer patients are diagnosed with regional or distant metastases.,NEI
scifact_1407,β1/Ketel is able to bind microtubules.,NEI
scifact_0,0-dimensional biomaterials lack inductive properties.,NEI
